id,title,authors,venue,year
1174,estimating compilation time of a query optimizer 2003,"dengfeng gao , eileen tien lin , jun rao , ihab f. ilyas , guy m. lohman",sigmod conference,
1175,"pbir - perception-based image retrieval lihyuarn l. chang , edward y. chang , tim cheng",,sigmod conference,2001.0
1176,experiments on query expansion for internet yellow page services using web log mining 2002,"iko pramudiono , katsumi takahashi , masaru kitsuregawa , yusuke ohura",vldb,
1177,supervised wrapper generation with lixto,"sergio flesca , robert baumgartner , georg gottlob",vldb,2001.0
1178,alphasort : a risc machine sort sigmod conference,"david b. lomet , jim gray , zarka cvetanovic , chris nyberg , tom barclay",,1994.0
1179,mapping extended entity relationship model to object modeling technique 1995,joseph fong,sigmod record,
1180,data management issues in electronic commerce ( panel ) sigmod conference 1999,m. tamer özsu,,
1181,"answering queries with aggregation using views h. v. jagadish , shaul dar , divesh srivastava , alon y. levy",,vldb,1996.0
1182,"ghost : fine granularity buffering of indexes cheng hian goh , kian-lee tan , beng chin ooi , d. sim vldb 1999",,,
1183,a database platform for bioinformatics,sandeepan banerjee,vldb,2000.0
1184,"powerbookmarks : a system for personalizable web information organization , sharing , and management kazuyuki shimazu , sougata mukherjea , yi-leh wu , divyakant agrawal , kyoji hirata , yukiyoshi saito , quoc vu , corey bufi , wen-syan li , kevin chen-chuan chang , edward y. chang , reiko ito , yoshinori hara , yutaka kimura",,sigmod conference,1999.0
1185,"lh * - a scalable , distributed data structure donovan a. schneider , marie-anne neimat , witold litwin",,acm trans . database syst .,1996.0
1186,"maximizing buffer and disk utilizations for news on-demand raymond t. ng , jinhai yang",,vldb,1994.0
1187,relational databases for querying xml documents : limitations and opportunities vldb,"jeffrey f. naughton , kristin tufte , chun zhang , gang he , david j. dewitt , jayavel shanmugasundaram",,1999.0
1188,"panel : querying networked databases divesh srivastava , nick koudas 2003",,sigmod conference,
1189,"a query language for multidimensional arrays : design , implementation , and optimization techniques sigmod conference","limsoon wong , rona machlin , leonid libkin",,1996.0
1190,"reasoning about spatial relationships in picture retrieval systems clement t. yu , a. prasad sistla , r. haddad vldb",,,1994.0
1191,"wireless graffiti - data , data everywhere matters tomasz imielinski , b. r. badrinath",,vldb,2002.0
1192,"using metadata for the intelligent browsing of structured media objects william i. grosky , farshad fotouhi , ishwar k. sethi sigmod record 1994",,,
1193,a performance study of four index structures for set-valued attributes of low cardinality vldb j. 2003,"guido moerkotte , sven helmer",,
1194,"a requirement-based approach to data modeling and re-engineering christian t. ramiller , alice h. muntz vldb",,,1994.0
1195,editor 's notes michael j. franklin sigmod record,,,1997.0
1196,"integrating reliable memory in databases peter m. chen , wee teck ng vldb 1997",,,
1197,"vertical data migration in large near-line document archives based on markov-chain predictions achim kraiss , gerhard weikum vldb 1997",,,
1198,"on schema matching with opaque column names and data values jaewoo kang , jeffrey f. naughton 2003",,sigmod conference,
1199,lots o ' ticks : real-time high performance time series queries on billions of trades and quotes 2001,"arthur t. whitney , dennis shasha",sigmod conference,
1200,"an anonymous electronic commerce scheme with an off-line authority and untrusted agents josep domingo-ferrer , jordi herrera-joancomartí sigmod record",,,1998.0
1201,the structured information manager : a database system for sgml documents ron sacks-davis vldb,,,1996.0
1202,the new middleware sigmod record,rich finkelstein,,1995.0
1203,disnic-plan : a nicnet based distributed database for micro-level planning in india m. moni vldb 1996,,,
1204,semantic and schematic similarities between database objects : a context-based approach vldb j.,"vipul kashyap , amit p. sheth",,1996.0
1205,ebusiness standards and architectures anil nori 2002,,vldb,
1206,"metadata in video databases ramesh jain , arun hampapur",,sigmod record,1994.0
1207,issues in network management in the next millennium vldb 1999,"michael l. brodie , surajit chaudhuri",,
1208,"cosima - your smart , speaking e-salesperson werner kießling , thorsten ehm , stefan holland , stefan fischer 0003",,sigmod conference,2001.0
1209,on efficiently implementing schemasql on an sql database system,"fereidoon sadri , laks v. s. lakshmanan , subbu n. subramanian",vldb,1999.0
1210,the power of languages for the manipulation of complex values vldb j. 1995,"serge abiteboul , catriel beeri",,
1211,"stream processing of xpath queries with predicates ashish kumar gupta , dan suciu 2003",,sigmod conference,
1212,"xml-enabled workflow management for e-services across heterogeneous platforms michael gillmann , german shegalov , gerhard weikum 2001",,vldb j.,
1213,db2 query parallelism : staging and implementation yun wang,,vldb,1995.0
1214,an overview of the emerging third-generation sql standard ( tutorial ) 1995,"nelson mendonça mattos , jim melton",sigmod conference,
1215,online association rule mining christian hidber sigmod conference,,,1999.0
1216,"using latency-recency profiles for data delivery on the web louiqa raschid , laura bright",,vldb,2002.0
1217,"smooth - a distributed multimedia database system christian hanin , roland tusch , carmen riedler , harald kosch , margit lang , lászló böszörményi , christian hofbauer , alexander bachlechner vldb",,,2001.0
1218,"clustering categorical data : an approach based on dynamical systems david gibson , jon m. kleinberg , prabhakar raghavan vldb j.",,,2000.0
1219,data mining in the bioinformatics domain vldb 2000,shalom tsur,,
1220,"simultaneous optimization and evaluation of multiple dimensional queries amit shukla , jeffrey f. naughton , yihong zhao , prasad deshpande sigmod conference",,,1998.0
1221,coss : the common object services specifications sigmod conference 1994,bruce e. martin,,
1222,application architecture : 2tier or 3tier ? what is dbms 's role ? ( panel abstract ) sigmod conference 2000,anil nori,,
1223,"emancipating instances from the tyranny of classes in information modeling jeffrey parsons , yair wand 2000",,acm trans . database syst .,
1224,from tree patterns to generalized tree patterns : on efficient evaluation of xquery 2003,"zhimin chen , stelios paparizos , h. v. jagadish , laks v. s. lakshmanan",vldb,
1225,"an xml-based wrapper generator for web information extraction david buttler , wei tang , calton pu , wei han , ling liu sigmod conference",,,1999.0
1226,"pix : exact and approximate phrase matching in xml yu xu , mary f. fernandez , sihem amer-yahia , divesh srivastava",,sigmod conference,2003.0
1227,"developing an indexing scheme for xml document collection using the oracle8i extensibility framework ying hu , timothy chorma , nipun agarwal , seema sundara , jagannathan srinivasan vldb",,,2001.0
1228,"answering xml queries on heterogeneous data sources ioana manolescu , donald kossmann , daniela florescu vldb",,,2001.0
1229,"business data management for b2b electronic commerce manfred a. jeusfeld , mareike schoop , christoph quix sigmod record",,,2002.0
1230,lopix : a system for xml data integration and manipulation wolfgang may 2001,,vldb,
1231,i/o reference behavior of production database workloads and the tpc benchmarks - an analysis at the logical level,"windsor w. hsu , alan jay smith , honesty c. young",acm trans . database syst .,2001.0
1232,weaving relations for cache performance vldb,"mark d. hill , anastassia ailamaki , david j. dewitt , marios skounakis",,2001.0
1233,"efficient algorithms for processing xpath queries reinhard pichler , georg gottlob , christoph koch vldb",,,2002.0
1234,xsb as an efficient deductive database engine 1994,"david scott warren , konstantinos f. sagonas , terrance swift",sigmod conference,
1235,agent-based semantic interoperability in infosleuth,"bruce bargmeyer , brad perry , jerry fowler , marian h. nodine",sigmod record,1999.0
1236,the xml typechecking problem dan suciu sigmod record 2002,,,
1237,"data integration and warehousing in telecom italia daniele nardi , maurizio lenzerini , stefano trisolini 1999",,sigmod conference,
1238,a compact b-tree 2002,"ivan t. bowman , peter bumbulis",sigmod conference,
1239,partitioned garbage collection of large object store 1997,"barbara liskov , umesh maheshwari",sigmod conference,
1240,"addendum to automatic generation of production rules for integrity maintenance letizia tanca , stefano paraboschi , piero fraternali , stefano ceri 1995",,acm trans . database syst .,
1241,information systems research at rwth aachen matthias jarke,,sigmod record,1995.0
1242,orthogonal optimization of subqueries and aggregation sigmod conference,"milind joshi , césar a. galindo-legaria",,2001.0
1243,"lineage tracing for general data warehouse transformations jennifer widom , yingwei cui vldb j.",,,2003.0
1244,design and implementation of rmp - a virtual electronic market place,"wolfgang klas , susanne boll , bernard battaglin",sigmod record,1998.0
1245,"modelling and querying video data rune hjelsvold , roger midtstraum",,vldb,1994.0
1246,the xps approach to loading and unloading terabyte databases sanket atal,,vldb,1996.0
1247,dynamic multi-resource load balancing in parallel database systems vldb,"robert marek , erhard rahm",,1995.0
1248,update propagation protocols for replicated databases 1999,"raghavan komondoor , abraham silberschatz , yuri breitbart , s. seshadri , rajeev rastogi",sigmod conference,
1249,cost models for overlapping and multiversion structures acm trans . database syst .,"yufei tao , jun zhang , dimitris papadias",,2002.0
1250,data mining-based intrusion detectors : an overview of the columbia ids project,"wenke lee , eleazar eskin , wei fan , salvatore j. stolfo , philip k. chan",sigmod record,2001.0
1251,"mocha : a self-extensible database middleware system for distributed data sources manuel rodriguez-martinez , nick roussopoulos 2000",,sigmod conference,
1252,"probview : a flexible probabilistic database system nicola leone , robert ross , laks v. s. lakshmanan , v. s. subrahmanian",,acm trans . database syst .,1997.0
1253,"proxy-based acceleration of dynamically generated content on the world wide web : an approach and implementation suresha , kaushik dutta , krithi ramamritham , anindya datta , helen m. thomas , debra e. vandermeer",,sigmod conference,2002.0
1254,the oracle warehouse gary hallmark 1995,,vldb,
1255,standards for databases on the grid sigmod record,"andrew eisenberg , jim melton , susan malaika",,2003.0
1256,evolution of groupware for business applications : a database perspective on lotus domino/notes 2000,"c. mohan , s. watts , ron barber , amit somani , markos zaharioudakis",vldb,
1257,index-driven similarity search in metric spaces acm trans . database syst . 2003,"gísli r. hjaltason , hanan samet",,
1258,discovering internet marketing intelligence through online analytical web usage mining 1998,"alex g. büchner , maurice d. mulvenna",sigmod record,
1259,"low-cost compensation-based query processing øystein torbjørnsen , øystein grøvlen , svein-olaf hvasshovd vldb 1998",,,
1260,editor 's notes sigmod record,ling liu,,2003.0
1261,visionary : a next generation visualization system for databases michael stonebraker,,sigmod conference,2003.0
1262,bhunt : automatic discovery of fuzzy algebraic constraints in relational data 2003,"peter j. haas , paul brown",vldb,
1263,efficient search of multi-dimensional b-trees vldb,"dave birdsall , hedieh yaghmai , harry leslie , rohit jain",,1995.0
1264,practical issues with commercial use of federated databases jim kleewein 1996,,vldb,
1265,parallelism and its price : a case study of nonstop sql/mp sigmod record,"susanne englert , ray glasstone , waqar hasan",,1995.0
1266,in cyber space no one can hear you scream vldb,chris pound,,1999.0
1267,"cache invalidation scheme for mobile computing systems with real-time data hei-wing leung , joe chun-hung yuen , edward chan , kam-yiu lam sigmod record 2000",,,
1268,"semantic access : semantic interface for querying databases naphtali rishe , rukshan athauda , artyom shaposhnikov , jun yuan , dmitry vasilevsky , xiaoling lu , xiaobin ma , shu-ching chen , alexander vaschillo",,vldb,2000.0
1269,"database design for incomplete relations mark levene , george loizou acm trans . database syst .",,,1999.0
1270,data streams : fresh current or stagnant backwater ? ( panel ) sigmod conference 2002,"joseph m. hellerstein , jennifer widom",,
1271,hippocratic databases vldb,"yirong xu , jerry kiernan , rakesh agrawal , ramakrishnan srikant",,2002.0
1272,"a new approach to developing and implementing eager database replication protocols gustavo alonso , bettina kemme 2000",,acm trans . database syst .,
1273,"intra-transaction parallelism in the mapping of an object model to a relational multi-processor system moira c. norrie , hans-jörg schek , michael rys vldb",,,1996.0
1274,indexing very high-dimensional sparse and quasi-sparse vectors for similarity searches vldb j.,"xiaoyang sean wang , changzhou wang",,2001.0
1275,the role of b2b engines in b2b integration architectures christoph bussler,,sigmod record,2002.0
1276,management of data and services in the environmental information system ( uis ) of baden-württemberg,"wolf-fritz riekert , roland mayer-föll , gerlinde wiest",sigmod record,1997.0
1277,merge replication in microsoft 's sql server 7.0 brad hammond,,sigmod conference,1999.0
1278,"qursed : querying and reporting semistructured data yannis papakonstantinou , michalis petropoulos , vasilis vassalos sigmod conference 2002",,,
1279,on the costs of multilingualism in database systems vldb 2003,"a. kumaran , jayant r. haritsa",,
1280,"wrapper generation for semi-structured internet sources craig a. knoblock , naveen ashish sigmod record 1997",,,
1281,"time series similarity measures and time series indexing gautam das , dimitrios gunopulos sigmod conference 2001",,,
1282,chair 's message sigmod record,richard t. snodgrass,,2000.0
1283,"dbminer : interactive mining of multiple-level knowledge in relational databases wei wang , krzysztof koperski , yongjian fu , osmar r. zaïane , jenny chiang , jiawei han sigmod conference 1996",,,
1284,answering complex sql queries using automatic summary tables,"roberta cochrane , hamid pirahesh , monica urata , markos zaharioudakis , george lapis",sigmod conference,2000.0
1285,"efficient incremental garbage collection for client-server object database systems laurent amsaleg , olivier gruber , michael j. franklin vldb 1995",,,
1286,user-oriented smart-cache for the web : what you seek is what you get ! sigmod conference 1998,"arnaud sahuguet , raman chandrasekar , zoé lacroix",,
1287,"maintaining data privacy in association rule mining shariq rizvi , jayant r. haritsa",,vldb,2002.0
1288,"merging models based on given correspondences philip a. bernstein , rachel pottinger",,vldb,2003.0
1289,"review of spatial databases with application to gis by philippe rigaux , michel scholl , and agnes voisard . morgan kaufmann 2002 2003",nancy wiegand,sigmod record,
1290,an approximate search engine for structural databases,"kaizhong zhang , qicheng ma , jason tsong-li wang , xinhuan zheng , xiong wang , dennis shasha , zasha weinberg , bruce a. shapiro",sigmod conference,2000.0
1291,answering queries using views : a survey vldb j. 2001,alon y. halevy,,
1292,semcog : an object-based image retrieval system and its visual query interface sigmod conference,"k. selçuk candan , wen-syan li , kyoji hirata , yoshinori hara",,1997.0
1293,finding hierarchical heavy hitters in data streams 2003,"graham cormode , flip korn , s. muthukrishnan , divesh srivastava",vldb,
1294,tribeca : a stream database manager for network traffic analysis mark sullivan,,vldb,1996.0
1295,a complete temporal relational algebra 1996,"debabrata dey , veda c. storey , terence m. barron",vldb j.,
1296,data modelling versus ontology engineering 2002,"mustafa jarrar , peter spyns , robert meersman",sigmod record,
1297,"implementing deductive databases by mixed integer programming anil nerode , colin bell , raymond t. ng , v. s. subrahmanian acm trans . database syst . 1996",,,
1298,evaluation of main memory join algorithms for joins with set comparison join predicates vldb,"guido moerkotte , sven helmer",,1997.0
1299,on relational support for xml publishing : beyond sorting and tagging sigmod conference 2003,"raghav kaushik , jeffrey f. naughton , surajit chaudhuri",,
1300,spatial joins using seeded trees,"chinya v. ravishankar , ming-ling lo",sigmod conference,1994.0
1301,xbase : making your gigabyte disk queriable 2002,"jianhua lv , yubin bao , hongjun lu , ge yu , guoren wang , yaxin yu",sigmod conference,
1302,"poesia : an ontological workflow approach for composing web services in agriculture ling liu , eduardo delgado assad , calton pu , renato fileto , claudia bauzer medeiros",,vldb j.,2003.0
1303,"database graph views : a practical model to manage persistent graphs alejandro gutiérrez , philippe pucheral , jean-marc thévenin , hermann steffen 1994",,vldb,
1304,accessing a relational database through an object-oriented database interface vldb 1995,"jack a. orenstein , d. n. kamber",,
1305,research in multi-organizational processes and semantic information brokering at the lsdis lab 2001,"john a. miller , amit p. sheth , ismailcem budak arpinar , krys kochut",sigmod record,
1306,"the sensor spectrum : technology , trends , and requirements sigmod record 2003","samuel madden , wei hong , joseph m. hellerstein",,
1307,visual web information extraction with lixto vldb,"georg gottlob , robert baumgartner , sergio flesca",,2001.0
1308,on completeness of historical relational query languages acm trans . database syst .,"james clifford , albert croker , alexander tuzhilin",,1994.0
1309,"the gmap : a versatile tool for physical data independence marvin h. solomon , yannis e. ioannidis , odysseas g. tsatalos vldb",,,1994.0
1310,describing semistructured data sigmod record,luca cardelli,,2001.0
1311,"towards adaptive workflow systems , cscw-98 workshop report mark klein , abraham bernstein , chrysanthos dellarocas sigmod record",,,1999.0
1312,"on periodic resource scheduling for continuous-media databases minos n. garofalakis , banu özden , abraham silberschatz",,vldb j.,1998.0
1313,"querying multiple bioinformatics data sources : can semantic web research help ? terence critchlow , matthew coleman , david buttler , wei han , daniel rocco , li xiong , ling liu , calton pu , renato fileto sigmod record 2002",,,
1314,"locking protocols for materialized aggregate join views michael watzke , gang luo , curt ellmann , jeffrey f. naughton vldb 2003",,,
1315,capbased-ams : a capability-based and event-driven activity management system 1996,"kamalakar karlapalem , helen p. yeung , patrick c. k. hung",sigmod conference,
1316,"issues in developing very large data warehouses vish jumani , lyman do , david van rossum , pamela drew , wei jin vldb",,,1998.0
1317,efficient algorithms for mining outliers from large data sets,"kyuseok shim , sridhar ramaswamy , rajeev rastogi",sigmod conference,2000.0
1318,maintenance of data cubes and summary tables in a warehouse sigmod conference,"inderpal singh mumick , dallan quass , barinderpal singh mumick",,1997.0
1319,"historical queries along multiple lines of time evolution vassilis j. tsotras , gad m. landau , jeanette p. schmidt vldb j.",,,1995.0
1320,"the impact of database research on industrial products ( panel summary ) david b. lomet , daniel barbará , josé a. blakeley , michael stonebraker , daniel h. fishman 1994",,sigmod record,
1321,xquery : a query language for xml donald d. chamberlin 2003,,sigmod conference,
1322,"the clustra telecom database : high availability , high throughput , and real-time response vldb","svein-olaf hvasshovd , øystein torbjørnsen , svein erik bratsberg , per holager",,1995.0
1323,efficient processing of joins on set-valued attributes sigmod conference 2003,nikos mamoulis,,
1324,evaluating queries with generalized path expressions sigmod conference,"guido moerkotte , sophie cluet , vassilis christophides",,1996.0
1325,"towards an infrastructure for temporal databases : report of an invitational arpa/nsf workshop ramez elmasri , richard t. snodgrass , babis theodoulidis , inderpal singh mumick , arie segev , m. tamer özsu , umeshwar dayal , niki pissinou , barbara pernici sigmod record 1994",,,
1326,"p-grid : a self-organizing structured p2p system zoran despotovic , manfred hauswirth , karl aberer , philippe cudré-mauroux , magdalena punceva , anwitaman datta , roman schmidt",,sigmod record,2003.0
1327,the cougar approach to in-network query processing in sensor networks 2002,"johannes gehrke , yong yao",sigmod record,
1328,automata theory for xml researchers sigmod record,frank neven,,2002.0
1329,act-net - the active database management system manifesto : a rulebase of adbms features ? sigmod record 1996,,,
1330,issues in data stream management sigmod record,"lukasz golab , m. tamer özsu",,2003.0
1331,tsql2 language specification 1994,"wolfgang käfer , curtis e. dyreson , arie segev , krishna g. kulkarni , michael d. soo , don s. batory , ramez elmasri , nikos a. lorentzos , nick kline , john f. roddick , gad ariav , james clifford , richard t. snodgrass , suryanarayana m. sripada , t. y. cliff leung , fabio grandi , ilsoo ahn , christian s. jensen",sigmod record,
1332,"mdm : a multiple-data-model tool for the management of heterogeneous database schemes paolo atzeni , riccardo torlone sigmod conference 1997",,,
1333,spatial data management for computer aided design sigmod conference 2001,"andreas müller , marco pötke , thomas seidl , hans-peter kriegel",,
1334,estimating the output cardinality of partial preaggregation with a measure of clusteredness vldb,"guido moerkotte , thomas neumann , sven helmer",,2003.0
1335,illuminating the dark side of web services michael l. brodie vldb,,,2003.0
1336,"cache conscious algorithms for relational query processing jeffrey f. naughton , ambuj shatdal , chander kant vldb 1994",,,
1337,"proxy-server architectures for olap panos kalnis , dimitris papadias",,sigmod conference,2001.0
1338,"logical design for temporal databases with multiple granularities alexander brodsky , sushil jajodia , claudio bettini , xiaoyang sean wang",,acm trans . database syst .,1997.0
1339,legodb : customizing relational storage for xml documents,"prasan roy , philip bohannon , jayant r. haritsa , jérôme siméon , maya ramanath , juliana freire",vldb,2002.0
1340,"an xml query engine for network-bound data daniel s. weld , alon y. halevy , zachary g. ives vldb j.",,,2002.0
1341,"v-trees - a storage method for long vector data maurício r. mediano , marcelo dreux , marco a. casanova vldb",,,1994.0
1342,application servers : born-again tp monitors for the web ? ( panel abstract ) sigmod conference 2001,c. mohan,,
1343,"dbmss on a modern processor : where does time go ? david a. wood , mark d. hill , david j. dewitt , anastassia ailamaki 1999",,vldb,
1344,high-performance extensible indexing vldb 1999,marcel kornacker,,
1345,"message from editor-in-chief , acm transactions on database systems won kim sigmod record 1999",,,
1346,"data management for earth system science james frew , jeff dozier sigmod record",,,1997.0
1347,dataguides : enabling query formulation and optimization in semistructured databases vldb 1997,"roy goldman , jennifer widom",,
1348,"approximate medians and other quantiles in one pass and with limited memory bruce g. lindsay , gurmeet singh manku , sridhar rajagopalan 1998",,sigmod conference,
1349,on-demand data elevation in hierarchical multimedia storage servers,"thomas papadakis , peter triantafillou",vldb,1997.0
1350,"rp * : a family of order preserving scalable distributed data structures witold litwin , marie-anne neimat , donovan a. schneider vldb 1994",,,
1351,"foreword by the vldb '98 pc chairmen : best papers of vldb '98 oded shmueli , jennifer widom 2000",,vldb j.,
1352,going public : open-source databases and database research philippe bonnet 2002,,sigmod conference,
1353,chorochronos : a research network for spatiotemporal database systems sigmod record,"enrico nardelli , timos k. sellis , andrew u. frank , stéphane grumbach , hans-jörg schek , manolis koubarakis , michel scholl , ralf hartmut güting , barbara pernici , christian s. jensen , nikos a. lorentzos , babis theodoulidis , yannis manolopoulos , peter widmayer",,1999.0
1354,"qxtract : a building block for efficient information extraction from plain-text databases luis gravano , eugene agichtein 2003",,sigmod conference,
1355,"information systems research at george mason university sushil jajodia , amihai motro , edgar h. sibley , alexander brodsky , larry kerschberg , xiaoyang sean wang , daniel barbará",,sigmod record,1997.0
1356,answering queries with useful bindings,"edward y. chang , chen li",acm trans . database syst .,2001.0
1357,heraclitus : elevating deltas to be first-class citizens in a database programming language acm trans . database syst . 1996,"dean jacobs , shahram ghandeharizadeh , richard hull",,
1358,using referential integrity to easily define consistent subset replicas brad hammond,,vldb,1996.0
1359,sentinel : an object-oriented dbms with event-based rules 1997,sharma chakravarthy,sigmod conference,
1360,pesto : an integrated query/browser for object databases vldb 1996,"laura m. haas , michael j. carey , vivekananda maganty , john h. williams",,
