id,title,authors,venue,year
577,d ( k ) - index : an adaptive structural summary for graph-structured data 2003,"chen qun , andrew lim , kian win ong",sigmod conference,
578,"are quorums an alternative for data replication ? bettina kemme , ricardo jiménez-peris , marta patiño-martínez , gustavo alonso acm trans . database syst .",,,2003.0
579,"probabilistic temporal databases , i : algebra alex dekhtyar , robert ross , v. s. subrahmanian acm trans . database syst .",,,2001.0
580,implementing the spirit of sql-99 sigmod conference 1999,paul brown,,
581,"content integration for e-business joseph m. hellerstein , michael stonebraker",,sigmod conference,2001.0
582,designing and mining multi-terabyte astronomy archives : the sloan digital sky survey,"alexander s. szalay , donald r. slutz , ani thakar , jim gray , peter z. kunszt",sigmod conference,2000.0
583,"mining needle in a haystack : classifying rare classes via two-phase rule induction ramesh c. agarwal , mahesh v. joshi 2001",,sigmod conference,
584,sqlem : fast clustering in sql using the em algorithm sigmod conference,"paul cereghini , carlos ordonez",,2000.0
585,"s-topss : semantic toronto publish/subscribe system ioana burcea , milenko petrovic , hans-arno jacobsen",,vldb,2003.0
586,managing business processes via workflow technology vldb 2001,frank leymann,,
587,control : continuous output and navigation technology with refinement on-line 1998,"bruce lo , tali roth , ron avnur , joseph m. hellerstein , chris olston , kirk wylie , bhaskaran raman , vijayshankar raman",sigmod conference,
588,"a metadatabase system for semantic image search by a mathematical model of meaning yasushi kiyoki , takanari hayama , takashi kitagawa sigmod record",,,1994.0
589,dlfm : a transactional resource manager,"hui-i hsiao , inderpal narang",sigmod conference,2000.0
590,hypertext databases and data mining soumen chakrabarti 1999,,sigmod conference,
591,"dynamic service matchmaking among agents in open information environments matthias klusch , katia p. sycara , seth widoff , jianguo lu",,sigmod record,1999.0
592,open issues in parallel query optimization sigmod record,"waqar hasan , patrick valduriez , daniela florescu",,1996.0
593,database issues in telecommunications network management ilsoo ahn,,sigmod conference,1994.0
594,mapinfo spatialware : a spatial information server for rdbms vldb,chebel mina,,1998.0
595,"efficient and cost-effective techniques for browsing and indexing large video databases kien a. hua , jung-hwan oh sigmod conference",,,2000.0
596,"the generalized pre-grouping transformation : aggregate-query optimization in the presence of dependencies timos k. sellis , aris tsois",,vldb,2003.0
597,mineset ( tm ) : a system for high-end data mining and visualization ? 1996,,vldb,
598,krdb ' 98 : the 5th international workshop on knowledge representation meets databases 1998,"alexander borgida , martin staudt , vinay k. chaudhri",sigmod record,
599,"the drill down benchmark peter a. boncz , tim rühl , fred kwakkel",,vldb,1998.0
600,"fast , randomized join-order selection - why use transformations ?","arjan pellenkoft , césar a. galindo-legaria , martin l. kersten",vldb,1994.0
601,expressing business rules ronald g. ross sigmod conference 2000,,,
602,fast joins using join indices vldb j. 1999,"kenneth a. ross , zhe li",,
603,"discovering all most specific sentences sanjeev saluja , hannu toivonen , roni khardon , heikki mannila , ram sewak sharm , dimitrios gunopulos 2003",,acm trans . database syst .,
604,"adaptive multi-stage distance join processing sukho lee , bongki moon , hyoseop shin sigmod conference 2000",,,
605,falcon : feedback adaptive loop for content-based retrieval,"christos faloutsos , leejay wu , katia p. sycara , terry r. payne",vldb,2000.0
606,"the fittest survives : an adaptive approach to query optimization kian-lee tan , son dao , hongjun lu",,vldb,1995.0
607,building database-driven electronic catalogs sherif danish sigmod record,,,1998.0
608,content-based image indexing tzi-cker chiueh vldb,,,1994.0
609,towards self-tuning data placement in parallel database systems sigmod conference,"mong-li lee , beng chin ooi , anirban mondal , kian-lee tan , masaru kitsuregawa",,2000.0
610,efficient optimistic concurrency control using loosely synchronized clocks sigmod conference,"barbara liskov , atul adya , robert gruber , umesh maheshwari",,1995.0
611,"rondo : a programming platform for generic model management philip a. bernstein , erhard rahm , sergey melnik sigmod conference 2003",,,
612,optimization techniques for queries with expensive methods joseph m. hellerstein acm trans . database syst . 1998,,,
613,eliminating costly redundant computations from sql trigger executions,"françois llirbat , françoise fabret , eric simon",sigmod conference,1997.0
614,"the need for distributed asynchronous transactions lyman do , prabhu ram , pamela drew",,sigmod conference,1999.0
615,"cache portal : technology for accelerating database-driven e-commerce web sites yusuf akca , cemal yilmaz , k. selçuk candan , wen-syan li , wei-kuang waine huang , qiong luo , divyakant agrawal , wang-pin hsiung , oliver po 2001",,vldb,
616,"mv3r-tree : a spatio-temporal access method for timestamp and interval queries dimitris papadias , yufei tao vldb 2001",,,
617,"o-o , what 's happening to db2 ? sigmod conference","richard swagerman , nelson mendonça mattos , michael j. carey , srinivasa narayanan , bennet vance , doug doole , serge rielau , donald d. chamberlin",,1999.0
618,comparing hybrid peer-to-peer systems 2001,"beverly yang , hector garcia-molina",vldb,
619,datasplash sigmod conference 1998,"vuk ercegovac , allison woodruff , michael stonebraker , mark lin , mybrid spalding , alexander aiken , chris olston , michael chu",,
620,a case for dynamic view management acm trans . database syst .,"nick roussopoulos , yannis kotidis",,2001.0
621,chameleon : an extensible and customizable tool for web data translation 2003,"riccardo torlone , paolo atzeni",vldb,
622,a workflow-based electronic marketplace on the web,"ibrahim cingil , nazife dimililer , nesime tatbul , ilker durusoy , asuman dogac , pinar koksal , sena nural arpinar",sigmod record,1998.0
623,"learning to match ontologies on the semantic web jayant madhavan , robin dhamankar , alon y. halevy , pedro domingos , anhai doan 2003",,vldb j.,
624,ansi sql hierarchical processing can fully integrate native xml sigmod record,michael m. david,,2003.0
625,the adabas buffer pool manager vldb,harald schöning,,1998.0
626,gigascope : high performance network monitoring with an sql interface sigmod conference 2002,"yuan gao , theodore johnson , charles d. cranor , vladislav shkapenyuk , oliver spatscheck",,
627,"the merge/purge problem for large databases salvatore j. stolfo , mauricio a. hernández sigmod conference 1995",,,
628,query processing in spatial network databases vldb,"nikos mamoulis , jun zhang , dimitris papadias , yufei tao",,2003.0
629,a nanotechnology-based approach to data storage vldb,"b. gotsmann , a. dholakia , g. cherubini , walter häberle , h. pozidis , michel despont , richard stutz , p. bächtold , c. hagleitner , t. r. albrecht , hugo e. rothuizen , gerd k. binnig , d. jubin , a. pantazi , m. a. lantz , e. eleftheriou , urs dürig , t. loeliger , peter vettiger , d. wiesmann , ute drechsler",,2003.0
630,fast high-dimensional data search in incomplete databases,"kian-lee tan , cheng hian goh , beng chin ooi",vldb,1998.0
631,"a template model for multidimensional inter-transactional association rules jeffrey xu yu , hongjun lu , ling feng , jiawei han 2002",,vldb j.,
632,"boat-optimistic decision tree construction wei-yin loh , raghu ramakrishnan , venkatesh ganti , johannes gehrke sigmod conference 1999",,,
633,continuously adaptive continuous queries over streams 2002,"samuel madden , mehul a. shah , vijayshankar raman , joseph m. hellerstein",sigmod conference,
634,diluting acid 1999,"peter thanisch , colin stirling , tim kempster",sigmod record,
635,"applying database visualization to the world wide web alberto o. mendelzon , dimitra vista , masum z. hasan 1996",,sigmod record,
636,"dtd-directed publishing with attribute translation grammars michael benedikt , aoying zhou , rajeev rastogi , shihui zheng , chee yong chan , wenfei fan vldb",,,2002.0
637,"primitives for workload summarization and implications for sql surajit chaudhuri , prasanna ganesan , vivek r. narasayya vldb 2003",,,
638,"safely and efficiently updating references during on-line reorganization betty salzberg , chendong zou vldb 1998",,,
639,an efficient method for checking object-oriented database schema correctness,"michele missikoff , anna formica , hans dietmar gröger",acm trans . database syst .,1998.0
640,reordering query execution in tertiary memory databases vldb,"michael stonebraker , sunita sarawagi",,1996.0
641,how system 11 sql server became fast t. k. rengarajan 1996,,vldb,
642,moving up the food chain : supporting e-commerce applications on databases anant jhingran sigmod record 2000,,,
643,"apex : an adaptive path index for xml data chin-wan chung , kyuseok shim , jun-ki min",,sigmod conference,2002.0
644,index configuration in object-oriented databases elisa bertino vldb j. 1994,,,
645,continuous nearest neighbor search 2002,"dimitris papadias , yufei tao , qiongmao shen",vldb,
646,chair 's message 2002,m. tamer özsu,sigmod record,
647,towards a richer web object model sigmod record 1998,frank manola,,
648,homer : a model-based case tool for data-intensive web sites sigmod conference 2000,"paolo atzeni , paolo merialdo , marco pecorone , marco magnante , giansalvatore mecca",,
649,"performance of data-parallel spatial operations hanan samet , erik g. hoel vldb",,,1994.0
650,managing large systems with db2 udb sigmod conference,chris eaton,,1998.0
651,"dbcache : middle-tier database caching for highly scalable e-business architectures c. mohan , sailesh krishnamurthy , mehmet altinel , christof bornhövd , hamid pirahesh , berthold reinwald sigmod conference",,,2003.0
652,"information translation , mediation , and mosaic-based browsing in the tsimmis system 1995","yannis papakonstantinou , joachim hammer , jennifer widom , jeffrey d. ullman , hector garcia-molina , kelly ireland",sigmod conference,
653,reminiscences on influential papers sigmod record,"jun rao , kenneth a. ross , johannes gehrke",,2003.0
654,"review of the data warehouse toolkit : the complete guide to dimensional modeling ( 2nd edition ) by ralph kimball , margy ross . john wiley & sons , inc. 2002 2003",alexander a. anisimov,sigmod record,
655,adaptive precision setting for cached approximate values sigmod conference 2001,"boon thau loo , jennifer widom , chris olston",,
656,"extracting schema from semistructured data serge abiteboul , rajeev motwani , svetlozar nestorov 1998",,sigmod conference,
657,"maximizing the output rate of multi-way join queries over streaming information sources josef burger , jeffrey f. naughton , stratis viglas",,vldb,2003.0
658,"fibonacci : a programming language for object databases antonio albano , renzo orsini , giorgio ghelli vldb j. 1995",,,
659,a theory of redo recovery sigmod conference,"mark r. tuttle , david b. lomet",,2003.0
660,an empirical performance study of the ingres search accelerator for a large property management database system,"john g. hughes , david a. bell , sarabjot s. anand",vldb,1994.0
661,distance-based indexing for high-dimensional metric spaces sigmod conference,"z. meral özsoyoglu , tolga bozkaya",,1997.0
662,provision of market services for eco compliant electronic market places sigmod record 2000,"sena nural arpinar , asuman dogac",,
663,report on the 2001 sigmod and pods awards philip a. bernstein,,sigmod record,2001.0
664,"disseminating updates on broadcast disks swarup acharya , stanley b. zdonik , michael j. franklin",,vldb,1996.0
665,"watermarking relational data : framework , algorithms and analysis vldb j.","peter j. haas , rakesh agrawal , jerry kiernan",,2003.0
666,"title , foreword , preface to the special issue on spatial database systems , index vol . 3",?,vldb j.,1994.0
667,research in database engineering at the university of namur sigmod record,jean-luc hainaut,,2003.0
668,maintaining database consistency in presence of value dependencies in multidatabase systems sigmod conference,"michèle cart , claire morpain , jean-françois pons , jean ferrié",,1996.0
669,integrating and customizing heterogeneous e-commerce applications vldb j.,"anat eyal , tova milo",,2001.0
670,"a semantic modeling approach for image retrieval by content ricky k. taira , ion tim ieong , wesley w. chu vldb j.",,,1994.0
671,"guest editorial yannis e. ioannidis , raghu ramakrishnan , philip a. bernstein vldb j. 2003",,,
672,electronic market : the roadmap for university libraries and members to survive in the information jungle,"peter c. lockemann , bethina schmitt , michael christoffel , sebastian pulkowski",sigmod record,1998.0
673,altruistic locking acm trans . database syst .,"jeannie shands , kenneth salem , hector garcia-molina",,1994.0
674,query processing in tertiary memory databases sunita sarawagi vldb,,,1995.0
675,component-based e-commerce : assesment of current practices and future directions,"martin bichler , arie segev , j. leon zhao",sigmod record,1998.0
676,"pattern matching and pattern discovery in scientific , program , and document databases kaizhong zhang , dennis shasha , jason tsong-li wang sigmod conference",,,1995.0
677,"building scalable internet applications with oracle8i server olga peschansky , josé alberto fernández , julie basu",,vldb,2000.0
678,the montage extensible datablade achitecture michael ubell 1994,,sigmod conference,
679,"quorum consensus in nested transaction systems kenneth j. goldman , nancy a. lynch",,acm trans . database syst .,1994.0
680,model and verification of a data manager based on aries dean kuo acm trans . database syst . 1996,,,
681,spatial queries in dynamic environments,"yufei tao , dimitris papadias",acm trans . database syst .,2003.0
682,"learning response time for websources using query feedback and application in query optimization jean-robert gruser , vladimir zadorozhny , louiqa raschid , tao zhan vldb j. 2000",,,
683,"virtual database technology venky harinarayan , ashish gupta , anand rajaraman sigmod record 1997",,,
684,time management for new faculty,"anastassia ailamaki , johannes gehrke",sigmod record,2003.0
685,"much ado about shared-nothing michael g. norman , peter thanisch , thomas zurek",,sigmod record,1996.0
686,optimized query execution in large search engines with global page ordering 2003,"torsten suel , xiaohui long",vldb,
687,query optimization at the crossroads ( panel ) surajit chaudhuri,,sigmod conference,1997.0
688,"strudel : a web-site management system alon y. levy , mary f. fernandez , jaewoo kang , daniela florescu , dan suciu 1997",,sigmod conference,
689,chair 's message m. tamer özsu 2003,,sigmod record,
690,on supporting containment queries in relational database management systems sigmod conference 2001,"guy m. lohman , david j. dewitt , qiong luo , jeffrey f. naughton , chun zhang",,
691,the p operator : discovering and ranking associations on the semantic web 2002,"kemafor anyanwu , amit p. sheth",sigmod record,
692,repositories and object oriented databases philip a. bernstein,,sigmod record,1998.0
693,editor 's notes sigmod record,ling liu,,2002.0
694,gte superpages : using ir techniques for searching complex objects,"steven d. whitehead , himanshu sinha , michael murphy",vldb,1997.0
695,a data model and data structures for moving objects databases sigmod conference,"markus schneider , enrico nardelli , luca forlizzi , ralf hartmut güting",,2000.0
696,middle east technical university software research and development center sigmod record 1996,asuman dogac,,
697,the handwritten trie : indexing electronic ink sigmod conference 1995,"padmavathi vallabhaneni , daniel barbará , walid g. aref",,
698,"research issues in federated database systems : report of efdbs '97 workshop fèlix saltor , mark roantree , mark w. w. vermeer , wilhelm hasselbring , martin schönhoff , markus strässler , barry eaglestone , stefan conrad 1997",,sigmod record,
699,"dynamic multidimensional histograms piotr indyk , sudipto guha , nitin thaper , nick koudas 2002",,sigmod conference,
700,inverted files versus signature files for text indexing acm trans . database syst .,"kotagiri ramamohanarao , justin zobel , alistair moffat",,1998.0
701,"aggregation algorithms for very large compressed data warehouses jaideep srivastava , jianzhong li , doron rotem",,vldb,1999.0
702,"delivering presentations from multimedia servers nevzat hurkan balkir , gultekin özsoyoglu vldb j.",,,1998.0
703,automated resolution of semantic heterogeneity in multidatabases,"a. r. hurson , simin h. pakzad , m. w. bright",acm trans . database syst .,1994.0
704,chair 's message,m. tamer özsu,sigmod record,2001.0
705,book review column karl aberer sigmod record,,,2002.0
706,"the design and performance evaluation of alternative xml storage strategies david j. dewitt , jianjun chen , chun zhang , feng tian 2002",,sigmod record,
707,containment of conjunctive queries : beyond relations as sets,"raghu ramakrishnan , yannis e. ioannidis",acm trans . database syst .,1995.0
708,from the guest editors - special section on data management issues in mobile computing 1995,"margaret h. dunham , abdelsalam helal",sigmod record,
709,a one-pass aggregation algorithm with the optimal buffer size in multidimensional olap vldb 2002,"yang-sae moon , young-koo lee , il-yeol song , kyu-young whang",,
710,"turbo-charging vertical mining of large databases jayant r. haritsa , devavrat shah , s. sudarshan , pradeep shenoy , mayank bawa , gaurav bhalotia",,sigmod conference,2000.0
711,"predator : an or-dbms with enhanced data types praveen seshadri , mark paskin",,sigmod conference,1997.0
712,"exploiting main memory dbms features to improve real-time concurrency control protocols özgür ulusoy , alejandro p. buchmann",,sigmod record,1996.0
713,approximate query processing : taming the terabytes 2001,"minos n. garofalakis , phillip b. gibbons",vldb,
714,querying multi-dimensional data indexed using the hilbert space-filling curve sigmod record 2001,"peter j. h. king , jonathan k. lawder",,
715,theory of answering queries using views alon y. halevy 2000,,sigmod record,
716,griddb : a database interface to the grid sigmod conference,"david t. liu , devesh parekh , michael j. franklin",,2003.0
717,"controlling access to published data using cryptography gerome miklau , dan suciu vldb 2003",,,
718,approximate query processing using wavelets vldb j.,"rajeev rastogi , minos n. garofalakis , kyuseok shim , kaushik chakrabarti",,2001.0
719,minimal probing : supporting expensive predicates for top-k queries sigmod conference,"kevin chen-chuan chang , seung-won hwang",,2002.0
720,"advanced data processing in krisys : modeling concepts , implementation techniques , and client/server issues","nelson mendonça mattos , joachim thomas , theo härder , stefan deßloch , bernhard mitschang",vldb j.,1998.0
721,letter to sigmod record editor 2002,nazih elderini,sigmod record,
722,progress on hpcc and nii marianne winslett sigmod record 1994,,,
723,"an aspect of query optimization in multidatabase systems ( extended abstract ) chiang lee , hongjun lu , chia-jung chen sigmod record",,,1995.0
724,"novel approaches in query processing for moving object trajectories yannis theodoridis , dieter pfoser , christian s. jensen 2000",,vldb,
725,microsoft english query 7.5 : automatic extraction of semantics from relational databases and olap cubes adam blum vldb 1999,,,
726,"reminiscences on influential papers kenneth a. ross , anastassia ailamaki , alfred v. aho 2002",,sigmod record,
727,rate-based query optimization for streaming information sources sigmod conference 2002,"jeffrey f. naughton , stratis viglas",,
728,emc information sharing : direct access to mvs data from unix and nt sigmod conference,walt kohler,,1999.0
729,"selectivity estimation in extensible databases - a neural network approach shaoyu zhou , m. seetha lakshmi",,vldb,1998.0
730,data warehousing and business intelligence for e-commerce - book review sigmod record 2002,frank g. goethals,,
731,selectivity estimation using probabilistic models sigmod conference,"daphne koller , lise getoor , benjamin taskar",,2001.0
732,bridging heterogeneity : research and practice of database middleware technology,"günter sauter , fernando de ferreira rezende",vldb,1998.0
733,"what do those weird xml types want , anyway ? 1999",steven j. derose,vldb,
734,"report on the 4th international conference on mobile data management panos k. chrysanthis , arkady b. zaslavsky , morris sloman sigmod record 2003",,,
735,"a prototype content-based retrieval system that uses virtual images to save space leonard brown , le gruenwald 2001",,vldb,
736,warehousing workflow data : challenges and opportunities vldb,"umeshwar dayal , ming-chien shan , angela bonifati , fabio casati",,2001.0
737,declustering databases on heterogeneous disk systems,"doron rotem , sridhar seshadri , ling tony chen",vldb,1995.0
738,toward learning based web query processing vldb 2000,"yanlei diao , hongjun lu , zengping tian , songting chen",,
739,information finding in a digital library : the stanford perspective,"tak w. yan , hector garcia-molina",sigmod record,1995.0
740,"fast image retrieval using color-spatial information kian-lee tan , tat-seng chua , beng chin ooi , wynne hsu 1998",,vldb j.,
741,delivering high availability for inktomi search engines eric a. brewer sigmod conference,,,1998.0
742,the araneus web-base management system sigmod conference,"giansalvatore mecca , paolo merialdo , alessandro masci , paolo atzeni , giuseppe sindoni",,1998.0
743,"cure : an efficient clustering algorithm for large databases sudipto guha , rajeev rastogi , kyuseok shim 1998",,sigmod conference,
744,"algorithms for materialized view design in data warehousing environment kamalakar karlapalem , jian yang , qing li vldb 1997",,,
745,enhanced hypertext categorization using hyperlinks,"byron dom , piotr indyk , soumen chakrabarti",sigmod conference,1998.0
746,lore : a lightweight object repository for semistructured data 1996,"janet l. wiener , jason mchugh , serge abiteboul , qingshan luo , anand rajaraman , dallan quass , jeffrey d. ullman , roy goldman , hugo rivero , jennifer widom , svetlozar nestorov , kevin haas",sigmod conference,
747,"vqbd : exploring semistructured data jihwang yeo , sudarshan s. chawathe , thomas baby sigmod conference",,,2001.0
748,the grid : an application of the semantic web 2002,"carole a. goble , david de roure",sigmod record,
749,grid and applications ( industrial session ) 2003,frank leymann,vldb,
750,"i3 : intelligent , interactive investigaton of olap data cubes sunita sarawagi , gayatri sathe",,sigmod conference,2000.0
751,"algebraic change propagation for semijoin and outerjoin queries timothy griffin , bharat kumar sigmod record 1998",,,
752,"checking the temporal integrity of interactive multimedia documents s. tserkezoglou , timos k. sellis , barbara pernici , michalis vazirgiannis , isabelle mirbel vldb j.",,,2000.0
753,"efficient filtering of xml documents with xpath expressions rajeev rastogi , pascal felber , chee yong chan , minos n. garofalakis",,vldb j.,2002.0
754,"of crawlers , portals , mice and men : is there more to mining the web ? ( panel ) sigmod conference 1999","kyuseok shim , rajeev rastogi , minos n. garofalakis , sridhar ramaswamy",,
755,"design and user testing of a multi-paradigm query interface to an object-oriented database dac khoa doan , alistair c. kilgour , norman w. paton sigmod record 1995",,,
756,efficient checking of temporal integrity constraints using bounded history encoding jan chomicki,,acm trans . database syst .,1995.0
757,"what is the nearest neighbor in high dimensional spaces ? charu c. aggarwal , alexander hinneburg , daniel a. keim vldb 2000",,,
758,dtl 's dataspot : database exploration as easy as browsing the web,"gadi entin , shai geva , eran palmon , shaul dar",sigmod conference,1998.0
759,3d geographic network displays,"taosong he , stephen g. eick , kenneth c. cox",sigmod record,1996.0
760,"data-driven , one-to-one web site generation for data-intensive applications 1999","stefano paraboschi , piero fraternali , stefano ceri",vldb,
761,processing star queries on hierarchically-clustered fact tables vldb,"nikos karayannidis , frank ramsak , timos k. sellis , rudolf bayer , robert fenk , klaus elhardt , volker markl , roland pieringer , aris tsois",,2002.0
762,"winnowing : local algorithms for document fingerprinting alexander aiken , daniel shawcross wilkerson , saul schleimer 2003",,sigmod conference,
763,"access path support for referential integrity in sql2 joachim reinert , theo härder vldb j.",,,1996.0
764,enhanced nearest neighbour search on the r-tree sigmod record 1998,"ada wai-chee fu , king lum cheung",,
765,"eos : an extensible object store euthimios panagos , alexandros biliris sigmod conference 1994",,,
766,schemasql - a language for interoperability in relational multi-database systems vldb,"fereidoon sadri , laks v. s. lakshmanan , iyer n. subramanian",,1996.0
767,reconciling schemas of disparate data sources : a machine-learning approach sigmod conference 2001,"anhai doan , pedro domingos , alon y. halevy",,
768,optimal clip ordering for multi-clip queries vldb j.,"raymond t. ng , paul shum",,1998.0
769,"process automation as the foundation for e-business fabio casati , ming-chien shan",,vldb,2000.0
770,research issues in active database systems : report from the closing panel at ride-ads '94 sigmod record 1994,jennifer widom,,
771,acm tods in this internet age richard t. snodgrass sigmod record,,,2003.0
