id,title,authors,venue,year
1932,"querying and mining data streams : you only get one look minos n. garofalakis , johannes gehrke vldb",,,2002.0
1933,"is web-site management a database problem ? daniela florescu , dan suciu , alon y. levy vldb",,,1998.0
1934,the zero-delay data warehouse : mobilizing heterogeneous databases vldb 2003,eva kühn,,
1935,"report in isdo ' 00 : the caise * 00 workshop on infrastructures for dynamic business-to-business service outsourcinga paul w. p. j. grefen , heiko ludwig 2000",,sigmod record,
1936,"oracle8i index-organized table and its application to new domains anh-tuan tran , chuck freiwald , aravind yalamanchi , samuel defazio , souripriya das , ramkumar krishnan , jagannathan srinivasan , mahesh jagannath , eugene inseok chong , jayanta banerjee vldb 2000",,,
1937,"from nested-loop to join queries in oodb peter m. g. apers , hennie j. steenhagen , henk m. blanken , rolf a. de by",,vldb,1994.0
1938,on wrapping query languages and efficient xml integration sigmod conference,"jérôme siméon , vassilis christophides , sophie cluet",,2000.0
1939,object database evolution using separation of concerns 2000,"peter sawyer , awais rashid",sigmod record,
1940,commercial use of database technology vldb,harald schöning,,2003.0
1941,workshop on workflow management in scientific and engineering applications - report sigmod record,"gottfried vossen , richard mcclatchey",,1997.0
1942,formal aspects of concurrency control in long-duration transaction systems using the nt/pv model,"henry f. korth , gregory d. speegle",acm trans . database syst .,1994.0
1943,interaction of query evaluation and buffer management for information retrieval,"björn þór jónsson , divesh srivastava , michael j. franklin",sigmod conference,1998.0
1944,"evaluating top-k selection queries luis gravano , surajit chaudhuri vldb",,,1999.0
1945,"a conceptual architecture for semantic web enabled web services dieter fensel , alexander maedche , christoph bussler sigmod record",,,2002.0
1946,"title , preface to the special issue on persistent object systems vldb j. 1995",?,,
1947,the pyramid-technique : towards breaking the curse of dimensionality,"christian böhm , hans-peter kriegel , stefan berchtold",sigmod conference,1998.0
1948,a goal-driven auto-configuration tool for the distributed workflow management system mentor-lite sigmod conference 2000,"german shegalov , gerhard weikum , wolfgang wonner , michael gillmann , jeanine weißenfels",,
1949,xpathlearner : an on-line self-tuning markov histogram for xml path selectivity estimation vldb 2002,"lipyeow lim , ronald parr , jeffrey scott vitter , sriram padmanabhan , min wang",,
1950,on the computation of multidimensional aggregates vldb,"sunita sarawagi , ashish gupta , rakesh agrawal , prasad deshpande , jeffrey f. naughton , sameet agarwal , raghu ramakrishnan",,1996.0
1951,"champagne : data change propagation for heterogeneous information systems holger meinecke , uwe heinkel , ralf rantzau , carmen constantinescu",,vldb,2002.0
1952,rolex : relational on-line exchange with xml 2003,"pradeep shenoy , xin dong , henry f. korth , philip bohannon , p. p. s. narayan , chengkai li , sumit ganguly",sigmod conference,
1953,anipqo : almost non-intrusive parametric query optimization for nonlinear cost functions 2003,"arvind hulgeri , s. sudarshan",vldb,
1954,warlock : a data allocation tool for parallel warehouses,"thomas stöhr , erhard rahm",vldb,2001.0
1955,editor 's notes michael j. franklin,,sigmod record,1999.0
1956,"quest : a project on database mining ramakrishnan srikant , balakrishna r. iyer , christos faloutsos , arun n. swami , h. miranda , sakti p. ghosh , a. mahboob , maurice a. w. houtsma , michael j. carey , tomasz imielinski , rakesh agrawal 1994",,sigmod conference,
1957,"cache-conscious concurrency control of main-memory indexes on shared-memory multiprocessor systems sangyong hwang , kihong kim , sang kyun cha , keunjoo kwon vldb 2001",,,
1958,"clio : a semi-automatic tool for schema mapping laura m. haas , renée j. miller , mauricio a. hernández",,sigmod conference,2001.0
1959,random i/o scheduling in online tertiary storage systems sigmod conference 1996,"bruce hillyer , abraham silberschatz",,
1960,"a comparison of three user interfaces to relational microcomputer data bases carl medsker , margaret christensen , il-yeol song sigmod record",,,1995.0
1961,"referee : an open framework for practical testing of recommender systems using researchindex dan cosley , steve lawrence , david m. pennock 2002",,vldb,
1962,"publish/subscribe on the web at extreme speed dennis shasha , radu preotiuc-pietro , joão pereira , kenneth a. ross , françois llirbat , françoise fabret vldb 2000",,,
1963,"xpath processing in a nutshell georg gottlob , christoph koch , reinhard pichler 2003",,sigmod record,
1964,the samos active dbms prototype sigmod conference 1995,"klaus r. dittrich , stella gatziu , andreas geppert",,
1965,"a non-uniform data fragmentation strategy for parallel main-menory database systems nick bassiliades , ioannis p. vlahavas vldb 1995",,,
1966,the future of web services - i adam bosworth sigmod conference,,,2003.0
1967,supporting efficient multimedia database exploration vldb j. 2001,"k. selçuk candan , yoshinori hara , kyoji hirata , wen-syan li",,
1968,"unql : a query language and algebra for semistructured data based on structural recursion mary f. fernandez , peter buneman , dan suciu vldb j. 2000",,,
1969,multi-dimensional database allocation for parallel data warehouses vldb 2000,"holger märtens , erhard rahm , thomas stöhr",,
1970,"the network as a global database : challenges of interoperability , proactivity , interactiveness , legacy arne koschel , ralf kramer , ralf nikolai , peter c. lockemann , mechtild wallrath , ulrike kölsch , hans-dirk walter vldb",,,1997.0
1971,"integration of data mining with database technology amir netz , surajit chaudhuri , jeff bernhardt , usama m. fayyad vldb",,,2000.0
1972,binding propagation in disjunctive databases vldb 1998,sergio greco,,
1973,"manipulating interpolated data is easier than you thought stéphane grumbach , philippe rigaux , luc segoufin",,vldb,2000.0
1974,"iceberg-cube computation with pc clusters yu yin , raymond t. ng , alan s. wagner 2001",,sigmod conference,
1975,"performance issues in incremental warehouse maintenance hector garcia-molina , wilburt labio , yingwei cui , jennifer widom , jun yang",,vldb,2000.0
1976,chair 's message richard t. snodgrass sigmod record,,,1997.0
1977,environment information systems - guest editor 's foreword oliver günther 1997,,sigmod record,
1978,"infosphere project : system support for information flow applications calton pu , jonathan walpole , karsten schwan 2001",,sigmod record,
1979,"a multi-paradigm querying approach for a generic multimedia database management system ji-rong wen , qing li , wei-ying ma , hongjiang zhang",,sigmod record,2003.0
1980,"integrating dynamically-fetched external information into a dbms for semistructured data jennifer widom , jason mchugh 1997",,sigmod record,
1981,"watchman : a data warehouse intelligent cache manager peter scheuermann , radek vingralek , junho shim vldb 1996",,,
1982,an architecture to support scalable online personalization on the web,"kaushik dutta , debra e. vandermeer , krithi ramamritham , anindya datta , shamkant b. navathe",vldb j.,2001.0
1983,"active rules for xml : a new paradigm for e-services stefano ceri , stefano paraboschi , angela bonifati vldb j. 2001",,,
1984,influencing database language standards leonard gallagher,,sigmod record,1994.0
1985,static detection of security flaws in object-oriented databases keishi tajima sigmod conference 1996,,,
1986,report on second international workshop on advanced issues of e-commerce and web-based information systems sigmod record,"philip s. yu , kun-lung wu",,2000.0
1987,"searching for dependencies at multiple abstraction levels jef wijsen , toon calders , raymond t. ng",,acm trans . database syst .,2002.0
1988,tutorial : ldap directory services - just another database application ? sigmod conference 2000,"anand deshpande , shridhar shukla",,
1989,databases for networks 1994,h. v. jagadish,sigmod conference,
1990,carnot and infosleuth : database technology and the world wide web,"k. ong , christine tomlinson , darrell woelk , c. unnikrishnan , william bohrer , nigel jacobs",sigmod conference,1995.0
1991,thesus : organizing web document collections based on link semantics 2003,"benjamin nguyen , iraklis varlamis , maria halkidi , michalis vazirgiannis",vldb j.,
1992,b-tree page size when caching is considered david b. lomet,,sigmod record,1998.0
1993,aggregate-query processing in data warehousing environments vldb,"venky harinarayan , dallan quass , ashish gupta",,1995.0
1994,"generalizing gloss to vector-space databases and broker hierarchies luis gravano , hector garcia-molina",,vldb,1995.0
1995,fundamentals of data warehouses : 2nd revised and extended edition vernon hoffner 2003,,sigmod record,
1996,stream : the stanford stream data manager 2003,"jennifer widom , mayur datar , shivnath babu , justin rosenstein , itaru nishizawa , arvind arasu , keith ito , brian babcock",sigmod conference,
1997,performance of future database systems : bottlenecks and bonananzas,chaitanya k. baru,vldb,1996.0
1998,"eager aggregation and lazy aggregation weipeng p. yan , per-åke larson vldb 1995",,,
1999,an ontological analysis of the relationship construct in conceptual modeling acm trans . database syst . 1999,"veda c. storey , yair wand , ron weber",,
2000,"retrieval of composite multimedia objects surajit chaudhuri , shahram ghandeharizadeh , cyrus shahabi",,vldb,1995.0
2001,"curio : a novel solution for efficient storage and indexing in data warehouses helen m. thomas , krithi ramamritham , anindya datta vldb",,,1999.0
2002,"cost models do matter : providing cost information for diverse data sources in a federated system mary tork roth , laura m. haas , fatma ozcan vldb",,,1999.0
2003,context-based prefetch for implementing objects on relations vldb,"philip a. bernstein , david shutt , shankar pal",,1999.0
2004,unix rdbms : the next generation bill rosneblatt 1994,,sigmod record,
2005,design and implementation of a genetic-based algorithm for data mining vldb,sunil choenni,,2000.0
2006,"on multi-resolution document transmission in mobile web stanley m. t. yau , antonio si , dennis mcleod , hong va leong 1999",,sigmod record,
2007,"efficient retrieval of similar shapes davood rafiei , alberto o. mendelzon vldb j.",,,2002.0
2008,"description logics for semantic query optimization in object-oriented database systems claudio sartori , sonia bergamaschi , domenico beneventano",,acm trans . database syst .,2003.0
2009,"one-dimensional and multi-dimensional substring selectivity estimation raymond t. ng , divesh srivastava , h. v. jagadish , olga kapitskaia vldb j.",,,2000.0
2010,on processing xml in ldap vldb 2001,"pedro josé marrón , georg lausen",,
2011,"mining database structure ; or , how to build a data quality browser vladislav shkapenyuk , tamraparni dasu , s. muthukrishnan , theodore johnson 2002",,sigmod conference,
2012,real-time database - similarity semantics and resource scheduling sigmod record,"tei-wei kuo , aloysius k. mok",,1996.0
2013,"incremental maintenance for materialized views over semistructured data vasilis vassalos , janet l. wiener , michael rys , serge abiteboul , jason mchugh vldb 1998",,,
2014,efendi : federated database system of cadlab sigmod conference 1995,"bernd burkert , yaron engel , ralf böttger , gerd kachel , elke radeke , silvia kolmschlag , dietmar nolte",,
2015,trade press news sigmod record,rafael alonso,,1994.0
2016,what happens during a join ? dissecting cpu and memory optimization effects vldb,"stefan manegold , martin l. kersten , peter a. boncz",,2000.0
2017,"domino : databases for moving objects tracking jutai zhou , ouri wolfson , sam chamberlain , a. prasad sistla , bo xu sigmod conference",,,1999.0
2018,"applying formal methods to semantic-based decomposition of transactions paul ammann , indrakshi ray , sushil jajodia 1997",,acm trans . database syst .,
2019,workshop report on experiences using object data management in the real-world akmal b. chaudhri 1998,,sigmod record,
2020,"set containment joins : the good , the bad and the ugly karthikeyan ramasamy , jeffrey f. naughton , jignesh m. patel , raghav kaushik vldb",,,2000.0
2021,rapid bushy join-order optimization with cartesian products,"bennet vance , david maier",sigmod conference,1996.0
2022,the aqua approximate query answering system,"sridhar ramaswamy , swarup acharya , phillip b. gibbons , viswanath poosala",sigmod conference,1999.0
2023,2003 sigmod innovations award speech 2003,donald d. chamberlin,sigmod record,
2024,wsq/dsq : a practical approach for combined querying of databases and the web 2000,"roy goldman , jennifer widom",sigmod conference,
2025,netcube : a scalable tool for fast data mining and compression 2001,"dimitris margaritis , christos faloutsos , sebastian thrun",vldb,
2026,"a new passenger support system for public transport using mobile database access koichi goto , yahiko kambayashi vldb 2002",,,
2027,hot mirroring : a study to hide parity upgrade penalty and degradations during rebuilds for raid5 sigmod conference,"masaru kitsuregawa , kazuhiko mogi",,1996.0
2028,"detection and classification of intrusions and faults using sequences of system calls joão b. d. cabrera , raman k. mehra , lundy m. lewis",,sigmod record,2001.0
2029,"multiscale histograms : summarizing topological relations in large spatial datasets xuemin lin , qing liu , yidong yuan , xiaofang zhou",,vldb,2003.0
2030,review of web caching and replication by michael rabinovich and oliver spatscheck . addison wesley 2002 sigmod record 2003,"qiang wang , brian d. davison",,
2031,buffering accesses to memory-resident index structures 2003,"jingren zhou , kenneth a. ross",vldb,
2032,"fast similarity search in the presence of noise , scaling , and translation in time-series databases king-ip lin , harpreet s. sawhney , rakesh agrawal , kyuseok shim 1995",,vldb,
2033,"modeling skewed distribution using multifractals and the ` 80-20 ' law abraham silberschatz , christos faloutsos , yossi matias",,vldb,1996.0
2034,"indexing the distance : an efficient method to knn processing cui yu , kian-lee tan , beng chin ooi , h. v. jagadish vldb 2001",,,
2035,"sleepers and workaholics : caching strategies in mobile environments tomasz imielinski , daniel barbará",,vldb j.,1995.0
2036,"s3 : similarity search in cad database systems hans-peter kriegel , stefan berchtold sigmod conference",,,1997.0
2037,sql query optimization : reordering for a general class of queries sigmod conference,"piyush goel , balakrishna r. iyer",,1996.0
2038,controlling data warehouses with knowledge networks,"jan-dirk becker , matthias jarke , andreas boehmer , elvira schaefer",vldb,2000.0
2039,"approximate xml joins h. v. jagadish , ting yu , divesh srivastava , sudipto guha , nick koudas",,sigmod conference,2002.0
2040,"statistical synopses for graph-structured xml databases minos n. garofalakis , neoklis polyzotis sigmod conference 2002",,,
2041,interview with michael stonebraker marianne winslett sigmod record 2003,,,
2042,"probabilistic object bases thomas eiter , v. s. subrahmanian , thomas lukasiewicz , james j. lu",,acm trans . database syst .,2001.0
2043,"sleepers and workaholics : caching strategies in mobile environments daniel barbará , tomasz imielinski sigmod conference",,,1994.0
2044,keynote address,larry ellison,sigmod conference,1995.0
2045,designing wrapper components for e-services in integrating heterogeneous systems vldb j.,"barbara pernici , massimo mecella",,2001.0
2046,versioning and configuration management in an object-oriented data model,edward sciore,vldb j.,1994.0
2047,"adaptive , hands-off stream mining anthony brockwell , spiros papadimitriou , christos faloutsos vldb",,,2003.0
2048,"modeling high-dimensional index structures using sampling christian a. lang , ambuj k. singh sigmod conference 2001",,,
2049,repeating history beyond aries,c. mohan,vldb,1999.0
2050,"storhouse metanoia - new applications for database , storage & data warehousing sigmod conference 2001","felipe cariño , pekka kostamaa , art kaufmann , john burgess",,
2051,"exploratory mining and pruning optimizations of constrained association rules alex pang , jiawei han , raymond t. ng , laks v. s. lakshmanan 1998",,sigmod conference,
2052,"the heterogeneity problem and middleware technology : experiences with and performance of database gateways klaudia hergula , fernando de ferreira rezende vldb",,,1998.0
2053,object-oriented extensions in sql3 : a status report krishna g. kulkarni,,sigmod conference,1994.0
2054,oracle xml db repository,viswanathan krishnamurthy,sigmod conference,2003.0
2055,foundations of statistical natural language processing - book review,gerhard weikum,sigmod record,2002.0
2056,optimization algorithms for exploiting the parallelism-communication tradeoff in pipelined parallelism vldb 1994,"waqar hasan , rajeev motwani",,
2057,"datamine - interactive rule discovery system aashu virmani , tomasz imielinski 1995",,sigmod conference,
2058,"caching strategies for data-intensive web sites khaled yagoub , patrick valduriez , valérie issarny , daniela florescu vldb 2000",,,
2059,querying the internet with pier 2003,"ion stoica , nick lanham , scott shenker , joseph m. hellerstein , boon thau loo , ryan huebsch",vldb,
2060,cache tables : paving the way for an adaptive database cache vldb,"hamid pirahesh , christof bornhövd , berthold reinwald , sailesh krishnamurthy , mehmet altinel , c. mohan",,2003.0
2061,"what is the data warehousing problem ? ( are materialized views the answer ? ) inderpal singh mumick , ashish gupta vldb 1996",,,
2062,"optimizing multiple dimensional queries simultaneously in multidimensional databases jeffrey xu yu , weifa liang , maria e. orlowska",,vldb j.,2000.0
2063,the building blocks for specifying communication behavior of complex objects : an activity-driven approach,"ling liu , robert meersman",acm trans . database syst .,1996.0
2064,calls for papers / announcements ?,,sigmod record,1994.0
2065,"record-boundary discovery in web documents yiu-kai ng , y. s. jiang , david w. embley sigmod conference",,,1999.0
2066,view maintenance in mobile computing 1995,"ouri wolfson , kailash narayanan , son dao , ramya raj , a. prasad sistla",sigmod record,
2067,"balancing performance and data freshness in web database servers nick roussopoulos , alexandros labrinidis vldb",,,2003.0
2068,"statix : making xml count jayant r. haritsa , juliana freire , maya ramanath , prasan roy , jérôme siméon sigmod conference 2002",,,
2069,transaction timestamping in ( temporal ) databases,"christian s. jensen , david b. lomet",vldb,2001.0
2070,integrated data management for mobile services in the real world vldb,"igor timko , torben bach pedersen , christian hage , christian s. jensen , laurynas speicys",,2003.0
2071,"realm-based spatial data types : the rose algebra markus schneider , ralf hartmut güting 1995",,vldb j.,
2072,"a transaction replication scheme for a replicated database with node autonomy david wai-lok cheung , ada wai-chee fu",,vldb,1994.0
2073,in-context peer-to-peer information filtering on the web aris m. ouksel 2003,,sigmod record,
2074,"the coral deductive system raghu ramakrishnan , s. sudarshan , divesh srivastava , praveen seshadri 1994",,vldb j.,
2075,t2 : a customizable parallel database for multi-dimensional data,"alan sussman , anurag acharya , joel h. saltz , chialin chang",sigmod record,1998.0
2076,"mapping data in peer-to-peer systems : semantics and algorithmic issues renée j. miller , anastasios kementsietsidis , marcelo arenas sigmod conference 2003",,,
2077,storage technology : raid and beyond garth a. gibson,,sigmod conference,1995.0
2078,"first-class views : a key to user-centered computing arnon rosenthal , edward sciore sigmod record",,,1999.0
2079,conceptual modeling and specification generation for b2b business process based on ebxml 2002,hyoungdo kim,sigmod record,
2080,"enhancing external consistency in real-time transactions shing-shan peng , kwei-jay lin 1996",,sigmod record,
2081,"naos - efficient and modular reactive capabilities in an object-oriented database system thierry coupaye , t. svensen , christine collet",,vldb,1994.0
2082,kweelt : more than just yet another framework to query xml !,arnaud sahuguet,sigmod conference,2001.0
2083,"storage service providers : a solution for storage management ? ( panel ) elizabeth a. m. shriver , bruce hillyer , wee teck ng , banu özden , eran gabber , david j. dewitt , john wilkes , jim gray , bruce gordon vldb 2001",,,
2084,"sybase replication server mark deppe , yongdong wang , alex gorelik sigmod conference 1994",,,
2085,"a scalable and highly available networked database architecture angelo pruscino , rafiul ahad , roger bamford vldb",,,1999.0
2086,xml and electronic commerce : enabling the network economy sigmod record 1998,"robert j. glushko , bart meltzer",,
2087,"hierarchies and relative operators in the olap environment maurizio rafanelli , elaheh pourabbas sigmod record",,,2000.0
2088,partition selection policies in object database garbage collection sigmod conference,"benjamin g. zorn , alexander l. wolf , jonathan e. cook",,1994.0
2089,mining insurance data at swiss life vldb,"jörg-uwe kietz , ulrich reimer , martin staudt",,1997.0
2090,"data bubbles : quality preserving performance boosting for hierarchical clustering jörg sander , hans-peter kriegel , peer kröger , markus m. breunig 2001",,sigmod conference,
2091,the database and information system research group at the university of ulm sigmod record,"peter dadam , wolfgang klas",,1997.0
2092,xpath queries on streaming data sigmod conference,"sudarshan s. chawathe , feng peng",,2003.0
2093,sigmod anthology editor 's message michael ley sigmod record 2000,,,
2094,query evaluation in deductive databases with alternating fixpoint semantics 1995,weidong chen,acm trans . database syst .,
2095,"query caching and optimization in distributed mediator systems sibel adali , yannis papakonstantinou , k. selçuk candan , v. s. subrahmanian 1996",,sigmod conference,
2096,managing intra-operator parallelism in parallel database systems,"david j. dewitt , manish mehta",vldb,1995.0
2097,"continuous k-nearest neighbor queries for continuously moving points with updates hanan samet , ken smith , glenn s. iwerks 2003",,vldb,
2098,the network is the database : data management for highly distributed systems sigmod conference,"michael j. wynblatt , julio c. navas",,2001.0
2099,amicalola report : database and information system research challenges and opportunities in semantic web and enterprises sigmod record 2002,"robert meersman , amit p. sheth",,
2100,"building a laboratory information system around a c++ - based object-oriented dbms nathan goodman , steve rozen , lincoln stein 1994",,vldb,
2101,"xxl - a library approach to supporting efficient implementations of advanced database queries björn blohsfeld , jens-peter dittrich , martin schneider , bernhard seeger , tobias schäfer , jochen van den bercken , jürgen krämer vldb 2001",,,
2102,querying continuous time sequences,"tore risch , ling lin",vldb,1998.0
2103,"xiss/r : xml indexing and storage system using rdbms philip j. harding , bongki moon , quanzhong li 2003",,vldb,
2104,"implementation of sql3 structured types with inheritance and value substitutability nelson mendonça mattos , serge rielau , bruce g. lindsay , stefan deßloch , you-chin fuh , brian t. tran , danko mannhaupt , linda demichel , weidong chen",,vldb,1999.0
2105,accelerating xpath location steps torsten grust sigmod conference,,,2002.0
2106,"indexing multiple sets christoph kilger , guido moerkotte 1994",,vldb,
2107,"improved query performance with variant indexes patrick e. o'neil , dallan quass sigmod conference",,,1997.0
2108,"olap , relational , and multidimensional database systems george colliat sigmod record 1996",,,
2109,new concurrency control algorithms for accessing and compacting b-trees vldb 1994,"andrea zisman , v. w. setzer",,
2110,update propagation strategies for improving the quality of data on the web vldb 2001,"nick roussopoulos , alexandros labrinidis",,
2111,information director 's message sigmod record,alberto o. mendelzon,,2000.0
2112,a performance study of transitive closure algorithms sigmod conference,"raghu ramakrishnan , shaul dar",,1994.0
2113,"data management in ecommerce : the good , the bad , and the ugly sigmod conference",avigdor gal,,2000.0
2114,efficiently publishing relational data as xml documents 2000,"berthold reinwald , jayavel shanmugasundaram , michael j. carey , eugene j. shekita , hamid pirahesh , bruce g. lindsay , rimon barr",vldb,
2115,"on parallel processing of aggregate and scalar functions in object-relational dbms michael jaedicke , bernhard mitschang sigmod conference 1998",,,
2116,"performing jobs without decompression in a compressed database system n. winterbottom , s. j. o'connell sigmod record 2003",,,
2117,"replication : db2 , oracle , or sybase ? 1995",doug stacey,sigmod record,
2118,"query processing techniques for multiversion access methods jochen van den bercken , bernhard seeger",,vldb,1996.0
2119,"garbage collection in object oriented databases using transactional cyclic reference counting s. sudarshan , prasan roy , abraham silberschatz , s. seshadri , srinivas ashwin",,vldb,1997.0
2120,"information , communication , and money : for what can we charge and how can we meter it ?","henry f. korth , stephen blott , abraham silberschatz",vldb,1998.0
2121,"an axiomatic model of dynamic schema evolution in objectbase systems m. tamer özsu , randal j. peters 1997",,acm trans . database syst .,
